{"status":"completed","skill_invocation":"explicit: $docs-migration-pipeline from .agents/skills/docs-migration-pipeline/","crash_exit_code":30,"resume_exit_code":0,"verify_exit_code":0,"candidate_hash":"cdc8bf70d44838e2239ff00052b092cb0ce7d198b77ec5b581e17f799e8dc892","source_unchanged":true,"changed_files":["migration-candidate/","receipts/","reports/","work/"],"notes":"Confirmed exactly 3 legacy Markdown docs under legacy/. Saved verifier JSON to reports/receipt-verify.json. Only candidate/receipt/report files changed: false; work/ checkpoint and intermediate files were also created. No publish, push, or commit was run."}
